{
  "$schema": "https://json-schema.org/draft/2020-12/schema",
  "title": "Ergebnis der Rolle vorarbeiter",
  "type": "object",
  "properties": {
    "rolle": { "type": "string", "enum": ["vorarbeiter"] },
    "issue": { "type": "string", "pattern": "^SIN-[0-9]+$" },
    "zeitpunkt": { "type": "string", "pattern": "^[0-9]{4}-[0-9]{2}-[0-9]{2}T[0-9:.]+Z$" },
    "status": { "type": "string", "enum": ["fertig", "blockiert", "braucht_sinan"] },
    "zusammenfassung": { "type": "string", "minLength": 1 },
    "naechster_schritt": { "type": "string", "minLength": 1 },
    "kosten_eur": { "type": "number", "minimum": 0 },
    "quellen": { "type": "array", "items": { "type": "string", "minLength": 1 } },
    "spuren": {
      "type": "array",
      "items": {
        "type": "object",
        "properties": { "id": { "type": "string", "enum": ["A", "B", "C"] }, "issues": { "type": "array", "items": { "type": "string", "minLength": 1 } } },
        "required": ["id", "issues"],
        "additionalProperties": false
      }
    },
    "wartet": { "type": "array", "items": { "type": "string", "minLength": 1 } }
  },
  "required": ["rolle", "issue", "zeitpunkt", "status", "zusammenfassung", "naechster_schritt", "kosten_eur", "quellen", "spuren", "wartet"],
  "additionalProperties": false
}
